Identifier,Question,correctAnswer,Answer1,Answer2,Answer3,Answer4,Answer5,Answer6
web301_q175,            Google Appengine is a __________ ?,2: PaaS,1: SaaS,2: PaaS,3: IaaS,4: MaaS,
web301_q176,            What are the programming languages supported by Google Appengine?,4: All of the above,1: Java,2: Go,3: Python,4: All of the above,
web301_q177,            Can you deploy a Swing application using Google App Engine?,3: Yes - via the JNLP file,1: Yes - the application will run as an applet in the browser,2: No - GAE does not support Swing. It only supports server side Java apps.,3: Yes - via the JNLP file  allow the user to download and run,4: No - The swing application file mime type is not supported by GAE,
web301_q178,            How do you view your application logs?,3: By using the GAE web console,1: By calling the GAE SDK command - mvn appengine:showlogs,2: By using the REST API - http://appengine.google.com/<appid>/logs,3: By using the GAE web console,4: All of the above,
web301_q179,            How does the appengine SDK run web applications locally?,1: By running a Jetty web container embedded in local application,1: By running a Jetty web container embedded in local application,2: By pushing the changes to Google's appengine dev environment,3: By running a separate Tomcat web server on the desktop,4: 1 and 3,
web301_q180,            You can upload the files to appengine by running _____________ command?,4: 1 and 2,1: appcfg.sh update myapp/war,2: mvn appengine:update,3: Manual upload using the appengine console,4: 1 and 2,
web301_q181,            What is the maximum number of instances of an app you can run?,3: Any number of instances,1: Only 1 instance per application,2: Maximum limit is 5 instances for basic accounts,3: Any number of instances,4: Any number of instances, but fair usage limit is 5,
web301_q182,            Which of the following types of applications you can build on GAE?,5: 1 and 4,1: A Java application that processes images from facebook,2: A Salesforce Apex application that sends email notifications,3: A Ruby application built using Rails framework,4: A Python application that provides full text search on Google+ posts,5: 1 and 4,
web301_q183,            What are the examples of quotas imposed by GAE?,4: All of the above,1: Free usage quota,2: Billable quota,3: Safety limit,4: All of the above,
web301_q184,            Which of the following are administrative functions when using GAE?,4: 2 and 3,1: Regular operating system patches and updates,2: Managing instance scaling - starting and shutting down instances,3: Managing database indices,4: 2 and 3,5: All of the above,
web301_q185,            To start working with Google Appengine  you need a _________ account?,1: Google account,1: Google account,2: Facebook account (using OAuth 2),3: Any OpenID account provider,4: Orkut account,
web301_q186,            Web apps built using Google Appengine can be restricted to __________?,4: All of the above,1: All google accounts users,2: Users of specified google apps domains,3: Any OpenID provider,4: All of the above,
web301_q187,            Application ID must follow the following limitations:,4: All of the above,1: Must be unique across Google Appengine (so that a unique URL can be given),2: Must not use google account names as application ID,3: Must not contain offensive words or trademarks,4: All of the above,
web301_q188,            You can use the following to build and deploy applications to GAE?,4: 1 and 2,1: Appengine maven plugin,2: Appengine Eclipse plugin,3: Appengine console,4: 1 and 2,
web301_q189,            What is the default port number for devserver?,8080,1: 80 (default web server port),8888,443,8080,
web301_q190,            Where does the GAE datastore save the data in devserver?,3: Application's WEB-INF folder,1: User's home directory,2: Maven source folder,3: Application's WEB-INF folder,4: Data is volatile and not persisted,
web301_q191,            How do you define an index while deploying the application?,1: Appengine SDK automatically generates and index on queried fields,1: Appengine SDK automatically generates and index on queried fields,2: Use the console to create an index,3: Use the console to delete an index,4: None of the above,
web301_q192,            What is the difference between resident and dynamic instances?,1: Resident instances are always running,1: Resident instances are always running ;  while dynamic instances are started on demand,2: Resident instances are free;  while dynamic instances are available in paid subscription only,3: Resident instances can handle more load than dynamic instances,
web301_q193,            If you application expects bursts of load at unpredictable   which type of instances should you use?,2: Dynamic instances so that application can scale when load increases temporarily,1: Resident instances so that the application is always ready to handle load,2: Dynamic instances so that application can scale when load increases temporarily,3: Tiny instances so that more can be created while waiting for burst load,4: Single Extra Large instance that can handle peak demand,
web301_q194,            How does the application scale on appengine?,4: All of the above,1: When requests are received  appengine automatically starts dynamic instances based on load,2: When no load is detected  appengine shuts down all instances of your app,3: You can specify the minimum number of instances that must be running even when idle, 4: appengine shuts down all instances of your app,
web301_q195,            If you need a Set  that returns elements based on their natural sort order  which Set implementation will you use?,2: TreeSet,1: HashSet,2: TreeSet,3: LinkedHashSet,4: None of the above - sets are not sorted,
web301_q196,            What is the declaration of books collection if Map<Integer  String> classics = books.headMap(1980);?,3: SortedMap<Integer String> books = new TreeMap<Integer String>();,1: Map<Integer String> books = new HashMap<Integer String>();,2: Map<int String> books = new TreeMap<int String>();,3: SortedMap<Integer String> books = new TreeMap<Integer String>();,4: SortedMap<int String> books = new HashMap<int string>();,5: None of the above,
